{"artifacts":[{"media_type":"application/json","path":"check-1f20f694/verification.json","retention":"legacy","role":"structured-source","sha256":"d2d56545a48b6a6483391a486de3730f258466cab03707adb67448324dc85562"}],"claim_scope":"historical evidence normalization; no new product or release claim","coverage":{"required_live_tests":null,"skips":null,"task_results":null},"execution":{"cache_bytes":{"unavailable_reason":"not present in structured source evidence","value":null},"exits":{"build":null,"collector":null,"controller":null,"product":null,"test":0,"transport":null},"invocations":{"corpus":null,"preclaim":null,"product":null,"reserved":null,"retry":null},"peak_rss_bytes":{"unavailable_reason":"not present in structured source evidence","value":null},"status":"passed","status_reason":"explicit verification.json exit_code=0","timing":{"elapsed_ns":null,"elapsed_seconds":42.97040633391589}},"gates":[],"inputs":{"effective_sha256":null,"manifest_sha256":null,"origin":null},"kind":"integration","limitations":["Fields absent from structured source evidence remain null; logs and prose were not parsed."],"provenance":{"binary":{"build_manifest_sha256":null,"sha256":null},"source":{"commit":"1f20f694775c3d8fd616eee4b22d9b13c30ff0fe","tree_or_digest":null},"toolchain":{"go":null,"mise":null}},"quality":{"compiler_test_failures":null,"compiler_test_top_level_passes":null},"redactions":[],"run_id":"check-1f20f694","schema_version":"graph-advantage-evidence/v1","semantics":{"completeness":null,"digest":null,"equal":null,"partial_failures":{"count":null,"sha256":null},"warnings":{"count":null,"sha256":null}},"source_records":{"verification.json":{"after_check":{"branch":"","head":"1f20f694775c3d8fd616eee4b22d9b13c30ff0fe","status":""},"before_check":{"branch":"","head":"1f20f694775c3d8fd616eee4b22d9b13c30ff0fe","status":""},"checkout":"/private/var/folders/7g/r0pg1n495tb1snh2zvk9y0_r0000gn/T/graph-integration-0c9e80f5-61zo1a1q/source","command":"mise run check","elapsed_seconds":42.97040633391589,"exit_code":0,"immutable":true,"log_sha256":"1c914a34617a2173b94030cfc06f8b9d571e6982955e07284135944acbbe74ab","scope":"single immutable verification; no corpus measurement or VM work","source_commit":"1f20f694775c3d8fd616eee4b22d9b13c30ff0fe"}},"workload":{"cache_mode":null,"mode":null,"operation":null,"profile":null}}
