{"artifacts":[{"media_type":"application/json","path":"review-linux-queries-initial.json","retention":"legacy","role":"case-source","sha256":"7f4b805328d5d9904c9cc99a253f64ccb8eeeaacef888f85dc886fdeb45215d2"},{"media_type":"application/json","path":"review-linux-queries-initial.json","retention":"legacy","role":"structured-source","sha256":"7f4b805328d5d9904c9cc99a253f64ccb8eeeaacef888f85dc886fdeb45215d2"}],"cases":{"count":5,"format":"graph-advantage-evidence-case/v1","path":"../cases/review-linux-queries-initial.ndjson","sha256":"320d8b5ac21325bd8bee36e2940c553b035d09ed2b7d88351d807e0ff29fba65"},"claim_scope":"historical evidence normalization; no new product or release claim","coverage":{"required_live_tests":null,"skips":null,"task_results":null},"execution":{"cache_bytes":{"unavailable_reason":"not present in structured source evidence","value":null},"exits":{"build":null,"collector":null,"controller":null,"product":null,"test":null,"transport":null},"invocations":{"corpus":null,"preclaim":null,"product":null,"reserved":null,"retry":null},"peak_rss_bytes":{"unavailable_reason":"not present in structured source evidence","value":null},"status":"unknown","status_reason":"no explicit structured terminal outcome","timing":{"elapsed_ns":null,"elapsed_seconds":null}},"gates":[],"inputs":{"effective_sha256":null,"manifest_sha256":null,"origin":"hand-authored interim review F2 promoted-method and alias correctness fixture"},"kind":"unknown","limitations":["Fields absent from structured source evidence remain null; logs and prose were not parsed."],"provenance":{"binary":{"build_manifest_sha256":null,"sha256":null},"source":{"commit":null,"tree_or_digest":null},"toolchain":{"go":null,"mise":null}},"quality":{"compiler_test_failures":null,"compiler_test_top_level_passes":null},"redactions":[{"path":"/cases/0/observed/response/repo_root","reason":"local filesystem path omitted"},{"path":"/cases/1/observed/response/repo_root","reason":"local filesystem path omitted"},{"path":"/cases/2/observed/response/repo_root","reason":"local filesystem path omitted"},{"path":"/cases/3/observed/response/repo_root","reason":"local filesystem path omitted"},{"path":"/cases/4/observed/response/repo_root","reason":"local filesystem path omitted"}],"run_id":"review-linux-queries-initial","schema_version":"graph-advantage-evidence/v1","semantics":{"completeness":null,"digest":null,"equal":null,"partial_failures":{"count":null,"sha256":null},"warnings":{"count":null,"sha256":null}},"source_records":{"review-linux-queries-initial.json":{"failed":false,"fixture_origin":"hand-authored interim review F2 promoted-method and alias correctness fixture"}},"workload":{"cache_mode":null,"mode":null,"operation":null,"profile":null}}
