{"artifacts":[{"media_type":"application/json","path":"check-8763b0d8/manifest.json","retention":"legacy","role":"structured-source","sha256":"977224cda01dc1274a83e7f2dda2d30e97c1e85d7b4cf961bce25d8faec4cc47"}],"claim_scope":"historical evidence normalization; no new product or release claim","coverage":{"required_live_tests":null,"skips":null,"task_results":null},"execution":{"cache_bytes":{"unavailable_reason":"not present in structured source evidence","value":null},"exits":{"build":null,"collector":null,"controller":null,"product":null,"test":null,"transport":null},"invocations":{"corpus":null,"preclaim":null,"product":null,"reserved":null,"retry":null},"peak_rss_bytes":{"unavailable_reason":"not present in structured source evidence","value":null},"status":"failed","status_reason":"explicit manifest.json status=failed","timing":{"elapsed_ns":null,"elapsed_seconds":null}},"gates":[],"inputs":{"effective_sha256":null,"manifest_sha256":null,"origin":null},"kind":"integration","limitations":["Fields absent from structured source evidence remain null; logs and prose were not parsed."],"provenance":{"binary":{"build_manifest_sha256":null,"sha256":null},"source":{"commit":null,"tree_or_digest":null},"toolchain":{"go":null,"mise":null}},"quality":{"compiler_test_failures":null,"compiler_test_top_level_passes":null},"redactions":[{"path":"/source_records/manifest.json/source/raw_log_source_path","reason":"local filesystem path omitted"}],"run_id":"check-8763b0d8","schema_version":"graph-advantage-evidence/v1","semantics":{"completeness":null,"digest":null,"equal":null,"partial_failures":{"count":null,"sha256":null},"warnings":{"count":null,"sha256":null}},"source_records":{"manifest.json":{"check_invocation":"mise run check","command":"mise run check","evidence_version":1,"execution_scope":"Evidence preservation only; no rerun, product invocation, corpus invocation, VM, or benchmark.","failure":{"location":"parser_test.go:1204","log_lines":"170-173,188-190","observed_detail":"unexpected parse status: DeterministicSyntaxError=true, ParseError=true, Partial=false, Code=E_PARSE_ERROR, Detail=tree-sitter syntax error nodes present","package":"github.com/entireio/entire-graph/internal/sem","test":"TestTreeSitterParserYAMLMasksQuotedMappingKeys"},"logged_stage_commands":["go test -race -timeout 30m ./...","go build -o entire-graph ./cmd/entire-graph","gofmt -s -w .","go vet ./...","sh scripts/entire-graph-statusline_test.sh"],"logged_stage_order":"not inferred from the retained output; mise scheduling/output interleaving was not captured","missing_capture":["No before/after source snapshot was captured for the check.","No immutable source manifest was captured at check start.","No exact source tree identity for the check invocation was recorded.","No post-check rerun is included."],"source":{"raw_log":"mise-check.txt","raw_log_sha256":"f3c9ad7214a9a3c2638950c2025e58324b9adfc8a06f16576181793862f5a0d5","raw_log_source_path":null,"raw_log_source_stat":{"ctime":"2026-09-07T11:57:19+0200","mtime":"2026-09-07T11:57:19+0200","size":12937},"retained_copy_stat":{"ctime":"2026-09-07T12:21:40+0200","mtime":"2026-09-07T12:21:40+0200","size":12937},"source_head_observed_during_capture":"8763b0d858131fbc864476c87b8987ba240526b8","source_head_observed_log":["8763b0d858131fbc864476c87b8987ba240526b8","2026-09-07T11:39:02+02:00","2026-09-07T11:39:02+02:00","Handle bounded Bash grammar gaps"]},"source_drift":{"claim":"No unchanged-source gate is claimed.","interpretation":"The retained log has no source snapshot or start/end source capture. Current working-tree modifications and their current observed mtimes are recorded only as present when evidence was preserved; no temporal attribution to the failed check is made.","observed_after_log":["internal/sem/parser.go modified","internal/sem/parser_yaml_regression_test.go modified","docs/implementation/graph-advantage/ledger.md modified","docs/implementation/graph-advantage/review-summary.md modified"],"parser_modification_stats":{"internal/sem/parser.go":{"ctime":"2026-09-07T12:03:34+0200","mtime":"2026-09-07T12:03:34+0200","size":358801},"internal/sem/parser_yaml_regression_test.go":{"ctime":"2026-09-07T12:00:39+0200","mtime":"2026-09-07T12:00:39+0200","size":4958}},"raw_log_stat":{"ctime":"2026-09-07T11:57:19+0200","mtime":"2026-09-07T11:57:19+0200","size":12937},"retained_copy_stat":{"ctime":"2026-09-07T12:21:40+0200","mtime":"2026-09-07T12:21:40+0200","size":12937},"untracked_after_log":["docs/implementation/graph-advantage/p1-corpus-20260905/frozen-baseline-initial.json","docs/implementation/graph-advantage/p1-corpus-20260905/frozen-baseline-pre-counts.json"]},"stages":{"internal_sem":"failed","other_logged_packages":"cmd/entire-graph, cmd/graph-bench, internal/bench, internal/cli, internal/compiler, internal/filedigest, internal/gitutil, internal/termsafe passed or cached before internal/sem failure","statusline":"151 passed, 0 failed"},"status":"failed","worker_reported_elapsed_seconds":1056.44,"worker_reported_elapsed_source":"retained log line: Finished in 1056.44s"}},"workload":{"cache_mode":null,"mode":null,"operation":null,"profile":null}}
