{"artifacts":[{"media_type":"application/json","path":"check-8c8b075d/subprocess-result.json","retention":"legacy","role":"structured-source","sha256":"84af7aff1e7653f4938cb7ff477404cf0174ea537b0627f135577ba2f0a1f611"},{"media_type":"application/json","path":"check-8c8b075d/verification.json","retention":"legacy","role":"structured-source","sha256":"3eb7282a8f09587bf9e78cfd493278d732d058fb189b192f0333868d4c4505c6"}],"claim_scope":"historical evidence normalization; no new product or release claim","coverage":{"required_live_tests":null,"skips":null,"task_results":null},"execution":{"cache_bytes":{"unavailable_reason":"not present in structured source evidence","value":null},"exits":{"build":null,"collector":null,"controller":null,"product":null,"test":0,"transport":null},"invocations":{"corpus":null,"preclaim":null,"product":null,"reserved":null,"retry":null},"peak_rss_bytes":{"unavailable_reason":"not present in structured source evidence","value":null},"status":"passed","status_reason":"explicit verification.json exit_code=0","timing":{"elapsed_ns":null,"elapsed_seconds":1265.559}},"gates":[],"inputs":{"effective_sha256":null,"manifest_sha256":null,"origin":null},"kind":"integration","limitations":["Fields absent from structured source evidence remain null; logs and prose were not parsed."],"provenance":{"binary":{"build_manifest_sha256":null,"sha256":null},"source":{"commit":"8c8b075d95503b931c7e9fa3bf2838e22c0f4be1","tree_or_digest":null},"toolchain":{"go":null,"mise":null}},"quality":{"compiler_test_failures":null,"compiler_test_top_level_passes":null},"redactions":[{"path":"/source_records/subprocess-result.json/cwd","reason":"local filesystem path omitted"},{"path":"/source_records/subprocess-result.json/git_trace2","reason":"local filesystem path omitted"},{"path":"/source_records/verification.json/artifacts/git_trace2_path","reason":"local filesystem path omitted"}],"run_id":"check-8c8b075d","schema_version":"graph-advantage-evidence/v1","semantics":{"completeness":null,"digest":null,"equal":null,"partial_failures":{"count":null,"sha256":null},"warnings":{"count":null,"sha256":null}},"source_records":{"subprocess-result.json":{"command":"MISE_JOBS=1 GOFLAGS=-p=1 GOMAXPROCS=2 GIT_TERMINAL_PROMPT=0 mise run check","cwd":null,"elapsed_seconds":1265.559,"exception":null,"exit_code":0,"expected_head":"8c8b075d95503b931c7e9fa3bf2838e22c0f4be1","finished_epoch":1788780350.542799,"git_trace2":null,"pid":86415,"raw_log":"mise-check.raw.log","started_epoch":1788779084.984115,"timed_out":false},"verification.json":{"artifacts":{"git_trace2_path":null,"git_trace2_sha256":"2f78a996a4f843bb0e5bd36b50200c2f87a08459ace7c3bccc85fd5f80912536","process_trees":"process-trees.txt","process_trees_sha256":"ff8a1aabba6c8788804de2f954c2f7bbe95dea2842f08486d7f0217d654aeb82","raw_log":"mise-check.raw.log","raw_log_sha256":"7f226ec2631e7f9a5941a6ae66c2cc9f5875a4753c67bb8c290492282191c63f"},"command":"MISE_JOBS=1 GOFLAGS=-p=1 GOMAXPROCS=2 GIT_TERMINAL_PROMPT=0 mise run check","elapsed_seconds":1265.559,"exception":null,"exit_code":0,"git_trace":{"actual_remote_transport_or_credential_prompt_matches":0,"note":"Trace contains local test commands that store URL strings in fixture configuration; no remote-https, git-remote-http, credential-helper, or username-prompt process ran."},"mise_elapsed_seconds":1265.35,"retry_count":0,"source_commit":"8c8b075d95503b931c7e9fa3bf2838e22c0f4be1","source_integrity":{"after_head":"8c8b075d95503b931c7e9fa3bf2838e22c0f4be1","after_status_bytes":0,"before_head":"8c8b075d95503b931c7e9fa3bf2838e22c0f4be1","before_status_bytes":0,"tracked_source_manifest_equal":true},"statusline_tests":{"failed":0,"passed":151},"timed_out":false}},"workload":{"cache_mode":null,"mode":null,"operation":null,"profile":null}}
