{"artifacts":[{"media_type":"application/x-ndjson","path":"relation-profile-v1.ndjson","retention":"legacy","role":"case-source","sha256":"30a257f56a1fc1c165f07f74806e41cfd1ccdfa929ee654c655917e1d7c35f98"}],"cases":{"count":450,"format":"graph-advantage-evidence-case/v1","path":"../cases/relation-profile-v1.ndjson","sha256":"d7feb687d4a2c6267370a7599ce793d5e0a8a83507cf6abd2e2d08e86574d5b0"},"claim_scope":"historical evidence normalization; no new product or release claim","coverage":{"required_live_tests":null,"skips":null,"task_results":null},"execution":{"cache_bytes":{"unavailable_reason":"not present in structured source evidence","value":null},"exits":{"build":null,"collector":null,"controller":null,"product":null,"test":null,"transport":null},"invocations":{"corpus":null,"preclaim":null,"product":null,"reserved":null,"retry":null},"peak_rss_bytes":{"unavailable_reason":"not present in structured source evidence","value":null},"status":"unknown","status_reason":"no explicit structured terminal outcome","timing":{"elapsed_ns":null,"elapsed_seconds":null}},"gates":[],"inputs":{"effective_sha256":null,"manifest_sha256":null,"origin":null},"kind":"performance","limitations":["Fields absent from structured source evidence remain null; logs and prose were not parsed."],"provenance":{"binary":{"build_manifest_sha256":null,"sha256":null},"source":{"commit":null,"tree_or_digest":null},"toolchain":{"go":null,"mise":null}},"quality":{"compiler_test_failures":null,"compiler_test_top_level_passes":null},"redactions":[],"run_id":"relation-profile-v1","schema_version":"graph-advantage-evidence/v1","semantics":{"completeness":null,"digest":null,"equal":null,"partial_failures":{"count":null,"sha256":null},"warnings":{"count":null,"sha256":null}},"source_records":{},"workload":{"cache_mode":null,"mode":null,"operation":null,"profile":null}}
